{
  "schema": 1,
  "pack": {
    "id": "baseline",
    "name": "Spellwarden Baseline for Agents",
    "version": "1.0",
    "description": "The eight Spellwarden baseline enforcement rules, mapped to OWASP and NIST."
  },
  "engine": {
    "version": "1.1.0",
    "rules_version": "2026.10.2"
  },
  "rules": [
    {
      "id": "SW-HK-001",
      "enabled": true
    },
    {
      "id": "SW-HK-002",
      "enabled": true
    },
    {
      "id": "SW-GW-003",
      "enabled": true
    },
    {
      "id": "SW-GW-004",
      "enabled": true
    },
    {
      "id": "SW-EG-005",
      "enabled": true
    },
    {
      "id": "SW-GW-006",
      "enabled": true
    },
    {
      "id": "SW-RG-007",
      "enabled": true
    },
    {
      "id": "SW-OB-008",
      "enabled": true
    }
  ],
  "org_rules": []
}
