{
  "schema": 1,
  "pack": {
    "id": "3b1e8c2a9d7f4e605a1b2c3d4e5f6071",
    "name": "Nothing enforced",
    "version": "1.2",
    "description": ""
  },
  "engine": {
    "version": "1.1.0",
    "rules_version": "2026.10.2"
  },
  "rules": [
    {
      "id": "SW-HK-001",
      "enabled": false
    },
    {
      "id": "SW-HK-002",
      "enabled": false
    },
    {
      "id": "SW-GW-003",
      "enabled": false
    },
    {
      "id": "SW-GW-004",
      "enabled": false
    },
    {
      "id": "SW-EG-005",
      "enabled": false
    },
    {
      "id": "SW-GW-006",
      "enabled": false
    },
    {
      "id": "SW-RG-007",
      "enabled": false
    },
    {
      "id": "SW-OB-008",
      "enabled": false
    }
  ],
  "org_rules": []
}
